{
  "company_name": "SME Company 9",
  "tax_id": "0301234508",
  "industry": "Sản xuất",
  "founded_year": 2018,
  "revenue": 5800000000,
  "net_profit": 460000000,
  "total_assets": 11600000000,
  "charter_capital": 2800000000,
  "collateral": "Không có",
  "loan_purpose": "Đầu tư máy móc",
  "years_borrowed": 8,
  "repayment_history": "Nợ xấu",
  "audited_financials": true
}