{
  "company_name": "Công ty TNHH ABC",
  "tax_id": "0312345678",
  "industry": "Sản xuất",
  "founded_year": 2015,
  "revenue": 15000000000,
  "net_profit": 2500000000,
  "total_assets": 20000000000,
  "charter_capital": 5000000000,
  "collateral": "Bất động sản",
  "loan_purpose": "Mở rộng mặt bằng",
  "years_borrowed": 2,
  "repayment_history": "Tốt",
  "audited_financials": true
}